Report_Date,Sector,News_Volume,Score_Qwen,Reason_Qwen,Score_Llama,Reason_Llama,Score_Gemma,Reason_Gemma,Final_Daily_Score,Final_Outlook
2026-01-07,Utilities,85,7.5,"The recent news indicates a positive trend for the Utilities sector, with significant events such as the surge in energy stocks following U.S. actions in Venezuela and acquisitions that bolster power generation capabilities. However, some negative signals, like the downgrade of Vistra's outlook, temper this optimism. Given the recency bias, the most recent events carry more weight, suggesting a generally positive but cautious sentiment.",8.2,"After analyzing the news, I found that the Utilities sector is experiencing a mix of positive and negative news. Recent news from the last 48 hours, such as the US military strike in Venezuela and the potential for increased oil production, has had a significant impact on the sector, outweighing older news. This recency bias has led me to focus on the recent developments, which suggest a bullish outlook for the sector.",8.5,"The recent news heavily skews towards a positive outlook for Utilities. The quantitative signal of 0.49 also supports this. The most recent news (Jan 6-7) highlights Chevron and Quantum Energy's bid for Lukoil assets, BTIG's positive picks, Microsoft's grid modernization, and Vistra's acquisition, all indicating growth and investment. The recency bias significantly impacts the assessment, as these recent developments outweigh older, less impactful news.",8.06,Bullish
2026-01-07,Other,70,7.5,"The recent news indicates a generally positive trend in global markets, with multiple stock exchanges closing higher and some companies reporting favorable developments. However, there is a mix of positive and negative events, such as the failed merger of STAAR Surgical and the recall notice from Volkswagen. Given the recency bias, the latest news about potential IPOs and positive stock movements outweighs older negative events, suggesting a slightly bullish sentiment.",8.2,"The market sentiment is Bullish due to the recent news of companies like Peloton Interactive and Snap being added to Wolfe Research's Tactical Outperform list, as well as the surge in stocks like Unusual Machines Inc. and Exail. However, Recency Bias may be influencing the analysis, as the news from the last 48 hours carries 3x more weight. Nevertheless, the overall sentiment remains positive, driven by the recent performances of various companies and indices.",8.5,"The quantitative signal of 0.40 suggests a moderately positive sentiment. Recent news (last 48 hours) is overwhelmingly positive, with multiple European markets (Netherlands, Germany, France, Denmark, Israel, Turkey, Morocco) reaching all-time or multi-month highs. The CSG IPO announcement and positive news regarding Mobileye and Strategy further bolster this positive trend, despite a few negative events like STAAR Surgical's failed merger and Volkswagen's recall. Due to the strong recency bias, the recent positive momentum outweighs the older, more mixed news.",8.06,Bullish
2026-01-07,Communication Services,42,7.5,"The recent news indicates a positive trend in the Communication Services sector, with significant announcements such as Hilton's expansion and American Airlines introducing free Wi-Fi for loyalty members. However, there are also negative signals like the lawsuit against Meta and regulatory actions against credit bureaus. Given the recency bias, the positive news from the last 48 hours carries more weight, suggesting an overall bullish sentiment.",8.2,"After analyzing the news feed, I applied a 3x weight to news from the last 48 hours. The recent news, particularly the positive developments in the AI sector, such as xFusion's IPO plans and Lucid, Nuro, and Uber's robotaxi debut, outweigh the negative news. However, the recency bias slightly skews the analysis, as recent news may not fully reflect the long-term market trends.",8.2,"The recent news heavily favors a bullish outlook for the Communication Services sector. The most recent headlines (Jan 7th) highlight positive developments like xFusion's IPO plans (reflecting AI investment interest), Xiaomi's product launch, and NBCUniversal's record ad sales for the Olympics, demonstrating strong demand. While there are some negative signals (Meta lawsuits, Grok concerns, Hilton controversies, and McGraw Hill's stock drop), the recency bias gives significantly more weight to the positive developments, particularly those related to AI and strong consumer demand. The quantitative signal of 0.16 further supports a positive sentiment.",7.96,Bullish
2026-01-07,Defense,1,7.5,"The most recent news from December 31, 2025, indicates a significant defense contract awarded to Lockheed Martin, which positively impacts the defense sector. Given the recency bias where recent news is given three times more weight, this positive signal dominates the overall sentiment despite the lack of other recent news entries. The quantitative signal of 0.27 also supports a slightly positive outlook.",8.1,"The market sentiment for 'Defense' as of 2026-01-07 is influenced by the recent news of Lockheed Martin receiving a $328.5 million contract from the Pentagon, which suggests a positive trend. However, no contradictory news was found in the given news feed. Recency bias plays a significant role in this analysis, as the recent news is given 3x more weight, contributing to a more optimistic outlook.",8.0,"The provided quantitative signal of 0.27 indicates a slightly positive market sentiment. The recent news, specifically the Pentagon's contract with Lockheed Martin for a significant military sale to Taiwan, strongly reinforces this positive outlook. Due to the recency bias, the news from December 31st carries significant weight, suggesting continued demand and investment in the defense sector.",7.86,Bullish
2026-01-07,Consumer Defensive,40,5.5,"The recent news, especially from the last 48 hours, shows a mixed but generally positive trend for the Consumer Defensive sector, with key companies like Nestle facing some setbacks but overall, there are indications of recovery and investment in the sector. However, the Nestle infant formula recall is a significant negative event that impacts the sentiment negatively. Considering the recency bias, the overall sentiment leans slightly positive due to the majority of recent positive developments.",8.2,"After analyzing the news feed, I noticed a mix of positive and negative news for the Consumer Defensive sector. Recent news from the last 48 hours, such as Lenovo and Nvidia's AI cloud gigafactory announcement, Nvidia's CEO saying next-generation chips are in full production, and Samsung planning to double its AI-powered mobile devices, have a stronger positive impact. However, older news, like Nestle's infant formula recall and McGraw Hill's stock drop, have a relatively lower weight due to recency bias, which gives more importance to recent events.",8.5,"The quantitative signal of 0.48 suggests a slightly positive sentiment. Recent news (last 48 hours) is overwhelmingly positive, with Nvidia's AI advancements, FDA's relaxed regulations on wearables, Bernstein's positive restaurant outlook, and UBS upgrades all contributing to a bullish tone. While Nestle's recall is concerning, the overall trend, heavily influenced by recency bias, points towards a positive outlook for the Consumer Defensive sector.",7.38,Bullish
2026-01-07,Real Estate,12,7.5,"The most recent news shows TPG's investment in Quarterra, indicating significant interest in multifamily developments despite some negative signals like Equifax and TransUnion's stock decline due to FHFA criticism. However, these negative signals are outweighed by the positive investment signal given the recency bias.",7.2,"The recent news about TPG buying a majority stake in Lennar's multifamily development platform, Quarterra, and Linkhome Holdings Inc.'s announcement of home robots, have a significant positive impact on the market sentiment. However, the news about Hilton's Minneapolis hotel canceling reservations for law enforcement officers and the criticism from the Federal Housing Finance Agency director on Equifax and TransUnion's pricing practices have a negative impact. Considering the recency bias, the recent news carries more weight, but the overall sentiment is still slightly positive due to the significant investment in the real estate sector.",5.5,"The recent news paints a mixed picture for the real estate sector. While the Hilton controversies (cancellations of ICE bookings and law enforcement reservations) and FHFA criticism of Equifax and TransUnion introduce negative sentiment, the TPG investment in Quarterra ($1 billion commitment) and Linkhome's stock surge due to home robot development signal potential growth and innovation. Due to the recency bias, the TPG and Linkhome news carries significantly more weight, outweighing the negative headlines, although the Hilton situation introduces uncertainty. ",6.74,Bullish
2026-01-08,Technology,201,8.5,"The recent news indicates a strong bullish sentiment towards the technology sector, especially with significant developments in AI and semiconductor markets. Recent events like Samsung's strong Q4 profits, Nvidia's new AI chip announcements, and increased investments in AI startups reinforce this positive trend. However, there are some bearish elements, such as Nvidia's requirement for full upfront payments from Chinese customers and Chinese authorities halting orders for Nvidia's H200 chips, which could impact sentiment negatively. Recency bias heavily influences the overall positive sentiment.",8.5,"The market sentiment for 'Technology' as of 2026-01-08 is Bullish, driven by recent news of strong demand for AI chips, partnerships, and investments in the sector. The recency bias is significant, with recent news from the last 48 hours, such as Nvidia's announcement of a new AI processor and Samsung's plans to double its AI-powered mobile devices, having a substantial impact on the overall outlook. The weighted analysis gives more importance to these recent developments, indicating a positive trend in the sector.",8.5,"The recent news overwhelmingly points to a bullish sentiment for the Technology sector. Recent headlines (Jan 7-8, 2026) highlight Nvidia's pricing strategy, surging demand for copper due to AI, record highs for SK Hynix and Samsung driven by AI memory products, OpenAI's massive stock grant pool, and strong earnings reports from Samsung, all indicating robust growth and investment. The quantitative signal of 0.55 further supports this positive outlook, though the recency bias significantly impacts this assessment, as the most recent data is heavily weighted.",8.5,Bullish
2026-01-08,Healthcare,115,8.5,"Recent news indicates a strong trend of mergers and acquisitions, positive clinical trial results, and strategic partnerships, which are highly positive for the healthcare sector. However, there are also some negative signals such as stock price drops due to public offerings and legal issues. Given the recency bias, the positive trends from the past 48 hours carry more weight, suggesting an overall bullish sentiment.",8.2,"Based on the news feed, the overall sentiment for the Healthcare sector is Bullish, with a slight Recency Bias towards the last 48 hours. Recent news such as Eli Lilly's acquisition talks with Ventyx Biosciences, positive trial results for various drugs, and the FDA's approval of several treatments have contributed to this outlook. However, news like the Trump administration's inability to proceed with a pilot drug rebate program and the decline in some biotech stocks have been outweighed by the positive developments.",8.5,"The recent news feed paints a largely positive picture for the Healthcare sector. Several companies (Eli Lilly, Genmab, Sera Prognostics, Vera Therapeutics, Aspire Biopharma, Alumis, Ironwood Pharmaceuticals, GH Research, Aktis Oncology, and others) are experiencing stock surges due to positive clinical trial results, FDA approvals/designations, acquisitions, and partnerships. While there are some negative developments (Genelux, Immuneering, Phathom, Revolution Medicines, and Zenas BioPharma stock declines), the overwhelmingly positive news, especially within the last 48 hours, significantly outweighs the negatives. The recency bias heavily favors a bullish sentiment due to the immediate market reactions to these recent developments.",8.4,Bullish
2026-01-08,Industrials,120,8.5,"The recent news from the past 48 hours shows a strong emphasis on defense spending increases and positive developments within the aerospace and defense industries, such as Lockheed Martin's significant contract wins and Austal's share surge due to the defense budget proposal. This recent positive trend outweighs some earlier mixed signals, demonstrating a clear recency bias towards a more optimistic outlook.",8.2,"Based on the given news feed, the Industrials sector is experiencing a mix of positive and negative news. Recent news, particularly from the last 48 hours, highlights the sector's resilience, with defense stocks surging due to the proposed $1.5 trillion defense budget and AI-driven demand for copper and memory chips. However, older news, such as the Trump administration's threat to ban dividends and buybacks, and the U.S. Transportation Department's proposal to relax penalties for airlines, may have had a temporary negative impact. Recency bias plays a significant role in this analysis, as recent news carries more weight. Overall, the sector's outlook is leaning towards a Bullish sentiment.",8.5,"The recent news heavily favors a bullish outlook for the Industrials sector. President Trump's proposed defense budget increase and subsequent actions supporting defense companies (Austal, Lockheed Martin, Northrop Grumman) are significant tailwinds. While Trump's threats regarding dividends and buybacks create some uncertainty, the overall sentiment is positive, especially given the AI-driven demand for copper and semiconductors (SK Hynix, Micron). The recency bias significantly impacts this assessment, as the most recent news (Jan 7-8) is overwhelmingly positive.",8.4,Bullish
2026-01-08,Financials,233,7.5,"The recent news indicates a generally positive sentiment towards financial institutions, particularly with UBS highlighting top European exchange picks and JPMorgan taking over Apple's credit card issuance. However, there are also some negative factors like the downgrades of certain banks and concerns over geopolitical tensions. Given the recency bias, the positive news from the last 48 hours carries more weight, suggesting a slightly bullish overall sentiment.",8.2,"Based on the provided news, the Financial sector is experiencing a mix of positive and negative sentiments. The recent news from the last 48 hours, such as the UBS highlighting top European exchange picks and Nvidia's requirement for full upfront payment for H200 chips, have a significant impact on the sector's outlook. However, the recency bias is not overly influential in this case, as the news from the last 48 hours is largely consistent with the overall trend.",7.5,"The most recent news paints a mixed but ultimately positive picture for the Financials sector. UBS's positive outlook on European exchanges and the rise of Chinese chip stocks following a potential Nvidia order halt suggest potential growth opportunities. While geopolitical tensions and concerns about US oil investment create some uncertainty, JPMorgan's expansion of its credit card business and the overall positive sentiment surrounding AI (OpenAI's funding and Nvidia's actions) outweigh these concerns. The recency bias strongly favors the positive signals from the last 48 hours.",7.73,Bullish
2026-01-08,Consumer Cyclical,126,7.5,"Recent news shows a mix of positive and negative developments, but the most recent 48 hours lean more positively with announcements like JPMorgan replacing Goldman Sachs as the Apple Card issuer and Morgan Stanley naming top payments stocks for 2026. This indicates a slight bullish bias due to recency bias.",8.2,"After analyzing the news, I noticed a mix of positive and negative news in the Consumer Cyclical sector. Recent news, particularly from the last 48 hours, has a 3x weightage, indicating a stronger impact on the overall sentiment. Despite some negative news, such as Tesla's declining sales in key European markets, the sector is expected to remain bullish due to the overall positive sentiment from recent news, including the US proposing to ease airline penalties, JPMorgan replacing Goldman as Apple Card issuer, and Hyundai's shares reaching a record high amid Nvidia partnership speculation. Recency bias is evident, as recent news has a significant impact on the overall sentiment.",7.5,"The recent news paints a mixed but leaning positive picture for the Consumer Cyclical sector. While First Brands' financial struggles and Mexico's stock market decline introduce some caution, positive developments like JPMorgan replacing Goldman as Apple Card issuer, Olaplex's takeover interest, and BYD's strong EV sales, alongside Nvidia's AI advancements, suggest underlying strength. The quantitative signal of 0.33 further supports a moderately positive sentiment, and the recency bias heavily favors these more recent, generally optimistic developments.",7.73,Bullish
2026-01-08,Communication Services,60,7.5,"The recent news shows a mix of positive and negative signals, but the most recent 48 hours are dominated by positive developments such as the successful IPO of Black Spade Acquisition III and the anticipated sales recovery of Nokia. These positive trends outweigh the earlier negative sentiments regarding defense stocks and the rejection of Paramount's bid for Warner Bros. The recency bias suggests a slightly more positive outlook.",7.5,"The Communication Services sector is experiencing a mix of positive and negative news, with recent news from the last 48 hours having a 3x weightage. The sector is influenced by news on defense companies, AI advancements, and media mergers, with some companies like Intel and Duolingo performing well. However, recency bias impacts our analysis, as recent news like Trump's executive order on defense companies and the decline of Integrated Media Technology's stock may have a more significant influence on the sector's sentiment.",7.5,"The recent news heavily skews towards a positive outlook for the Communication Services sector. President Trump's actions regarding defense companies, while initially appearing negative, are framed within a broader narrative of boosting defense spending. The positive reactions to Comcast's spin-off and Paramount's acquisition efforts, coupled with strong performances in media and technology sectors, indicate investor confidence. The recency bias significantly impacts this assessment, as the most recent news (within the last 48 hours) paints a more optimistic picture than earlier reports of stock declines and regulatory concerns.",7.5,Bullish
2026-01-08,Basic Materials,73,7.5,"Recent news shows a mix of positive and negative trends, but the most recent 48 hours have seen more positive signals, especially regarding increased copper demand and positive stock movements in related companies. This indicates a stronger bullish bias due to recency. However, there are also significant rejections of takeover offers and declines in some stocks, which slightly temper the overall positive sentiment.",8.5,"Based on the news feed, the Basic Materials sector is experiencing a mix of positive and negative news. Recent news, such as the 50% increase in copper demand by 2040 and the record copper price, suggests a Bullish trend. However, news like the decline in Japanese chemical stocks and the rejection of the takeover bid for BlueScope Steel indicate a Bearish sentiment. The recency bias has a significant impact, giving more weight to the recent news, which suggests a Bullish outlook. The news from the last 48 hours, such as the $8.8 billion takeover offer for BlueScope Steel and the record copper price, further solidify the Bullish sentiment.",5.5,"The quantitative signal of 0.34 suggests a slightly positive sentiment. Recent news (past 48 hours) is mixed, with Bluescope Steel's rejected takeover bid and Japanese chemical stock declines presenting headwinds, while the AI-driven copper demand forecast and Thyssenkrupp's potential steel unit sale offer positive catalysts. The recency bias heavily favors the mixed recent news, suggesting a cautious but ultimately positive outlook due to the long-term demand drivers highlighted.",7.17,Bullish
2026-01-08,Energy,150,7.5,"Recent news indicates a bullish trend towards the energy sector, particularly influenced by events surrounding Venezuela and U.S. military actions. The recency bias heavily favors the latest developments, which show increased optimism and investment opportunities for U.S. oil companies in Venezuela. However, geopolitical tensions and regulatory uncertainties add a layer of caution.",8.2,"Based on the news, the sector is Bullish due to recent positive developments such as the US military strike in Venezuela, which boosted energy and defense stocks, and the US Energy Secretary's plan to discuss Venezuela oil revival with industry executives. The recency bias impacts our analysis, giving more weight to recent news, which suggests a positive outlook. However, some older news, such as the decline in oil prices and the challenges faced by oil companies, still presents some concerns.",5.5,"The most recent news (Jan 8, 2026) indicates a complex situation. Oil prices are recovering, but stocks are volatile due to geopolitical tensions and US data. The focus on Venezuela, with the US VP asserting control over oil sales and Chevron seeking expanded licenses, suggests potential for increased US influence and oil production, which is generally positive for the energy sector. However, Trump's actions regarding defense companies and the overall mixed performance of US stocks introduce uncertainty. Due to the recency bias, the Venezuela-related news carries significant weight, suggesting a cautiously optimistic outlook.",7.07,Bullish
2026-01-08,Utilities,95,7.5,"The recent news shows a strong emphasis on U.S. oil companies seeking opportunities in Venezuela, which indicates potential growth in the energy sector. However, there are also negative signals such as lawsuits and stock price drops for some utility companies. Given the recency bias, the positive developments in the last 48 hours weigh heavily, suggesting an overall positive trend. The quantitative signal of 0.39 also supports a slightly positive sentiment.",8.2,"The Utilities sector appears to be Bullish due to recent news of increased investment in renewable energy, such as Ørsted-backed Revolution Wind seeking an injunction against the U.S. lease suspension, and NextEra Energy reaffirming its strong financial outlook. However, older news of Venezuelan oil companies seeking guarantees to invest in Venezuela and the US capture of Venezuela's President Maduro may have a negative impact, but the recency bias gives more weight to recent news. Overall, the sector is expected to be driven by the growth in renewable energy and the increasing demand for sustainable power.",5.5,"The most recent news (Jan 7-8, 2026) paints a mixed but ultimately cautiously optimistic picture for Utilities. The Chevron/Quantum bid for Lukoil assets, coupled with the US flexing military power in Venezuela, suggests potential for increased oil production and, consequently, demand for energy infrastructure. However, negative news like AES facing a lawsuit, NRG's CEO succession, and Munters' stock drop due to NVIDIA's chip innovation introduce uncertainty. The recency bias heavily favors the Venezuela-related news and the positive Jefferies report on Drax, which leans the sentiment towards a slightly positive outlook.",7.07,Bullish
2026-01-08,Other,80,7.5,"The recent news indicates a generally positive trend in global markets, with many indices closing higher. However, there are also instances of declines and mixed results. Given the recency bias, the positive signals from the past two days weigh heavily, suggesting a slightly bullish sentiment. The quantitative signal of 0.30 supports this positive outlook.",8.2,"The overall sentiment is Bullish due to recent positive news from the last 48 hours, such as the Australia's stock market closing higher, several major companies reporting earnings, and strong performances in various sectors like Technology, Healthcare, and Industrials. However, older news from the last week shows mixed results, including losses in some sectors, but the recent positive news outweighs the negative. Recency Bias impacts the analysis, giving more weight to the recent news, which is predominantly positive.",5.5,"The most recent news (Jan 7-8) shows a mixed bag globally, with some markets rising (Australia, Belgium, Finland, Germany, Turkey) and others falling (Colombia, Brazil, Norway, India, Indonesia). However, the quantitative signal of 0.30 suggests a slightly positive sentiment. The recency bias heavily favors the recent market movements, and while there's volatility, the overall trend leans slightly positive, especially with several indices hitting all-time highs.",7.07,Bullish
