Report_Date,Sector,News_Volume,Score_Qwen,Reason_Qwen,Score_Llama,Reason_Llama,Score_Gemma,Reason_Gemma,Final_Daily_Score,Final_Outlook
2025-12-17,Technology,245,8.5,"Recent news indicates a strong positive sentiment towards the technology sector, particularly in areas like AI, robotics, and semiconductor advancements. The most recent entries, such as the surge in Chinese robotaxi stocks and the significant funding rounds for tech firms, reinforce a bullish trend. However, there are some bearish elements, like the Taiwan stock market's decline and concerns over AI spending bubbles, but these are outweighed by the overwhelmingly positive recent developments.",8.2,"After analyzing the news feed, I applied a 3x weightage to the last 48 hours of news. The recent news indicates a positive sentiment towards the technology sector, with companies like Nvidia, Alphabet, and Amazon showing strong growth prospects. However, concerns about AI bubbles and the impact of Oracle's earnings on the sector are also present, but the overall trend suggests a bullish outlook. Recency bias is evident in the increased weightage given to recent news, which may have influenced the analysis towards a more positive outlook.",8.5,"The recent news feed overwhelmingly points towards a bullish sentiment for the Technology sector. The most recent articles highlight positive developments like Tencent and Alibaba's AI prospects, Chinese robotaxi stock gains, Apple's chip sourcing in India, and MetaX's impressive IPO. While Taiwan's stock market experienced a slight dip, the overall trend is positive, with significant investments in AI and data security. Due to the recency bias, the most recent news (last 48 hours) carries significantly more weight, reinforcing the positive outlook.",8.4,Bullish
2025-12-17,Communication Services,91,7.5,"The latest news indicates a generally positive trend within the Communication Services sector, especially with key players like Morgan Stanley highlighting leading Chinese tech stocks and JPMorgan identifying top European media stocks for 2026. However, there are some negative signals such as the rejection of certain acquisition offers and regulatory concerns. Recent news from the last 48 hours, given more weight, leans slightly positive, reinforcing a bullish sentiment.",8.2,"Based on the given news feed, the Communication Services sector appears to be Bullish, driven by recent news of Morgan Stanley highlighting Tencent and Alibaba as leading Chinese tech stocks poised to benefit from AI advancements, as well as positive updates on companies like Roku, Meta, and Disney. Recent news from the last 48 hours has a 3x weightage, which has a significant impact on the overall analysis, with news like Elon Musk's SpaceX planning a potential $25 billion IPO and Disney's $1 billion investment in OpenAI contributing to the positive sentiment. However, some negative news like the ban on social media for teens in Australia and the decline in E.W. Scripps' stock after rejecting Sinclair's acquisition offer also need to be considered.",8.2,"The recent news paints a generally positive picture for the Communication Services sector. Morgan Stanley's upgrade of Chinese tech stocks (Tencent and Alibaba) and RBC's positive outlook for Canadian telecom stocks signal potential growth. While there's M&A activity (Warner Bros. Discovery deals, Iron Horse Acquisition II IPO), and some negative news like E.W. Scripps' rejected offer and X Corp's lawsuit, the overall trend points towards innovation (Meta's Reels on TV, OpenAI partnership with Disney), infrastructure investment (FAA spending), and positive analyst ratings (Roku, SharkNinja). The recency bias heavily favors the positive developments from the last 48 hours, outweighing older, more mixed signals.",7.96,Bullish
2025-12-17,Healthcare,140,7.5,"The recent news indicates a predominantly positive trend in the healthcare sector, with several companies reporting successful trials, approvals, and financial gains. However, there are also instances of setbacks and legal issues. Given the recency bias, the positive developments in the last 48 hours, such as Sanofi's orphan drug designation and DBV Technologies' Phase 3 trial success, carry more weight, tilting the overall sentiment positively.",8.2,"Based on the provided news feed, the overall sentiment for the 'Healthcare' sector is Bullish due to the recent positive news, such as the EU orphan designation for Sanofi's efdoralprin alfa, promising clinical trial results for various treatments, and the approval of several new drugs. However, the recency bias is significant, and older news, such as the FDA's warning letters to Walmart and Target for selling recalled baby formula, may have a neutralizing effect on the overall sentiment. Nevertheless, the recent positive news outweighs the older news, leading to a Bullish outlook.",8.2,"The recent news paints a mixed but ultimately positive picture for the healthcare sector. While the Dana-Farber scandal introduces a negative element regarding research integrity, the overwhelming majority of recent news (within the last 48 hours) is positive, including FDA approvals (AstraZeneca, BioCryst, Amphastar), positive trial results (DBV Technologies, Monte Rosa, Immunome, Rhythm Pharmaceuticals, AC Immune, Eli Lilly), and IPO/licensing deals (Medline, Vir Biotechnology, Royalty Pharma). The quantitative signal of 0.36 further supports a positive sentiment, and the recency bias heavily favors the recent positive developments.",7.96,Bullish
2025-12-17,Basic Materials,88,7.5,"The recent news shows a mix of positive and negative signals, but the recency bias indicates a stronger emphasis on the latest developments. Recent events like the approval of the Anglo American and Teck Resources merger and the acquisition offers from Michelin and Korea Zinc indicate bullish sentiments. However, downgrades and declines in certain stocks temper this optimism. Overall, the recent upticks in specific companies and projects outweigh the broader market declines.",8.2,"The Basic Materials sector has shown a mix of positive and negative news, with recent news giving more weight to the overall sentiment. The recency bias is significant, with 3x more weight given to news from the last 48 hours, which has a net positive impact on the sector. Notable positive news includes the $200 million IPO of Iron Horse Acquisition II, the approval of the Anglo American and Teck Resources merger, and the expansion of Mkango's HyProMag USA plant.",8.2,"The quantitative signal of 0.36 suggests a slightly positive sentiment. Recent news (within the last 48 hours) is mixed, with some downgrades (UBS on chemicals) and market declines in several European and Asian markets (Portugal, Italy, Poland), but also significant positive developments. The approval of Anglo American and Teck Resources' merger, Korea Zinc's US smelter plans, and Mkango's expansion, along with positive analyst upgrades, strongly indicate increased investment and growth potential within the sector. The recency bias heavily favors the positive developments, outweighing the negative news.",7.96,Bullish
2025-12-17,Industrials,155,7.5,"The recent news shows a mix of positive developments such as Boeing's new Air Force One orders, defense stocks offering attractive values, and semiconductor stocks benefiting from AI investments. However, there are also negative signals like the downgrade of some companies and legal actions against others. Given the recency bias, the most recent news indicating strong defense and semiconductor investments slightly tilts the overall sentiment towards a positive outlook.",8.2,"After analyzing the news feed, I found that the recent news (from the last 48 hours) is predominantly positive for the Industrials sector, with several companies announcing significant contracts and partnerships. The news on Apple's potential shift in iPhone component assembly, Northrop Grumman's partnership with 4iG, and Airbus's AI contract for French defense systems are notable examples. However, older news on the sector's challenges, such as Cleveland-Cliffs' debt levels and Boeing's delayed Air Force One delivery, still carries some weight. Recency bias is evident, as recent news is given 3x more weight, but the overall sentiment remains positive.",7.5,"The quantitative signal of 0.28 suggests a slightly positive sentiment. Recent news is mixed, but leans slightly positive. The U.S. Air Force's purchase of Boeing aircraft and Northrop Grumman's defense tech collaboration are positive indicators. However, Trump's planned financial restrictions on defense contractors and Spirit Airlines' bankruptcy exploration introduce some caution. The recency bias heavily favors the recent positive news, especially the defense-related announcements, outweighing the negative news.",7.73,Bullish
2025-12-17,Financials,391,7.5,"The recent news indicates a generally positive sentiment towards the Financials sector, with notable mentions of share buybacks, upgrades, and positive outlooks from analysts. However, there are also some negative indicators such as profit warnings and downgrades. Given the recency bias, the positive news from the past 48 hours carries more weight, suggesting a predominantly positive outlook.",7.2,"The Financials sector is experiencing a mixed outlook due to recent news. The weighted analysis gives 3x more weight to news from the last 48 hours, which includes positive news such as Morgan Stanley highlighting Tencent and Alibaba as leading Chinese tech stocks, and Oracle's disappointing earnings report and cautious outlook. However, recent news also includes positive developments like the Federal Reserve's interest rate cut, which could boost the sector. Recency bias is impacting the analysis, but overall, the sector seems to be leaning towards a positive outlook. The recent news of Oracle's significant AI spending and debt concerns is a significant concern, but the sector's overall growth prospects and the Fed's rate cut are more influential in the short term.",8.2,"The quantitative signal of 0.26 suggests a slightly positive sentiment. Recent news is overwhelmingly positive, with stories highlighting AI advancements benefiting Chinese tech stocks (Tencent, Alibaba), a rebound in the tech sector, and significant investments in AI (Databricks) and data security (Cyera). While Asia fund managers are tempering return expectations due to high valuations, the overall tone is optimistic, and the recency bias heavily favors the positive developments of the last 48 hours.",7.63,Bullish
2025-12-17,Consumer Defensive,73,7.2,"The recent news from the past 48 hours indicates a generally positive trend for the Consumer Defensive sector, with appointments of new CEOs and optimistic outlooks from analysts. However, there are also some negative signals, such as profit warnings and downgrades. The recency bias suggests a slightly more positive tilt due to the latest news about Kraft Heinz's new CEO and analyst upgrades. Overall, the sentiment leans slightly positive.",7.8,"The market sentiment for Consumer Defensive sector is influenced by recent news, with Kraft Heinz's CEO appointment and potential split revision, DoorDash's AI-powered food discovery app launch, and RBC Capital's top pick in the European Consumer Staples sector. Recent news carries 3x more weight, with a focus on the last 48 hours, revealing a mixed sentiment. However, the overall trend leans towards a positive outlook due to the recent developments, which may counterbalance the negative impact of recency bias.",5.5,"The recent news feed is largely positive for the Consumer Defensive sector. Kraft Heinz's CEO appointment and potential split, coupled with RBC's positive pick of L'Oréal, suggest potential revitalization and strategic shifts. While Vital Farms' lowered outlook and downgrades for Costco and Perrigo present headwinds, the overall tone is cautiously optimistic, boosted by DoorDash's AI innovation and Jefferies' positive outlook on J.M. Smucker. The recency bias heavily favors the more recent positive developments, outweighing the negative news.",6.84,Bullish
2025-12-17,Utilities,134,7.5,"The recent news shows a mix of positive and negative signals, but there is a notable trend towards positive developments in the utilities sector, especially with Morgan Stanley forecasting positive growth due to increased data center power demand in 2026. However, there are also warnings about political risks and legal issues affecting some companies. The recency bias indicates that the most recent news, such as the lawsuit against Xcel Energy, slightly dampens the overall positive sentiment.",7.2,"After analyzing the news, I found that recent news (last 48 hours) has a significant impact on the overall sentiment. News such as Ford's $19.5 billion EV writedown, Ford and SK Innovation dissolving their battery joint venture, and Moody's revising CNX Resources and CNX Midstream outlooks to positive indicate a bearish trend. However, news like GE Vernova hitting a record high on bullish 2026 revenue outlook, buyback boost, and Schneider Electric announcing a €3.5 billion share buyback program by 2030 suggest a bullish trend. Considering the recency bias, recent news has a 3x weightage, which slightly tips the scale towards a bullish outlook.",5.5,"The quantitative signal of 0.16 suggests a slightly positive sentiment. Recent news is mixed, with the TransAlta coal plant extension indicating some continued reliance on traditional energy sources, while ReNew's solar project and TotalEnergies' deal with Google highlight renewable energy growth. However, Ford's EV retreat and Fitch's negative outlook for Cosan introduce caution, and the news regarding Xcel Energy and the Texas lawsuit adds further uncertainty. The recency bias heavily favors the mixed signals from the last 48 hours, showing a sector navigating transition and facing political and economic headwinds.",6.74,Bullish
2025-12-17,Real Estate,27,5.5,"Recent news indicates a mix of positive and negative signals, but the most recent 48 hours show predominantly positive developments such as Blackstone Mortgage Trust's outlook revision to stable and UK property ending the year on a positive note. These recent positive signals outweigh the older negative ones due to recency bias.",7.2,"After analyzing the news feed, I observed a mix of positive and negative news. Recent news from the last 48 hours, such as the UK property market's positive note and the upgrade of LXP Industrial Trust's outlook to positive, carries 3x more weight. However, recency bias may lead to overemphasis on recent news, potentially overshadowing the long-term implications of older news, such as the threat posed by Google's real estate ad format to Zillow's stock.",7.5,"The quantitative signal of 0.35 suggests a moderately positive sentiment. Recent news (last 48 hours) is largely positive, with Blackstone Mortgage Trust receiving a stable outlook, UK property showing resilience, and a significant joint venture in New York. However, the Zillow stock drop due to Google's new ad format and concerns about China Vanke introduce some caution, but the recency bias gives more weight to the positive developments, indicating a generally favorable market sentiment.",6.72,Bullish
2025-12-17,Consumer Cyclical,154,5.5,"The recent news shows a mix of positive and negative sentiments, but there is a notable increase in positive developments over the last 48 hours, especially in areas like tech recovery and retail optimism. The recency bias indicates that the most recent events, such as Tesla's surge and Ford's strategic shift towards electric vehicles, carry more weight and suggest a more optimistic trend. However, there are still significant challenges, such as the downgrading of some companies and legal actions against others.",8.2,"Based on the given news feed, the overall sentiment for the 'Consumer Cyclical' sector as of 2025-12-17 is Bullish. This is due to the recent surge in Chinese robotaxi stocks, positive developments in the tech sector, and a rebound in Asian stocks. However, older news items, such as the suspension of EV charging programs and the downgrading of Genuine Parts Company's outlook, are given less weight due to the recency bias, which favors more recent news.",5.5,"The quantitative signal of 0.21 suggests a slightly positive sentiment. Recent news is mixed, with Tesla's positive impact on Chinese robotaxi stocks and a tech sector rebound countered by economic uncertainties and negative outlooks from Moody's for Genuine Parts and Ford. However, the recent news regarding Tesla's battery investments, EU's reconsideration of combustion engine bans, and positive analyst views on several consumer staples and telecom stocks, all carry significantly more weight due to the recency bias, tilting the overall sentiment towards a cautiously optimistic outlook.",6.39,Neutral
2025-12-17,Energy,151,5.5,"Recent news indicates a mix of positive and negative signals, but the majority of the most recent news (within the last 48 hours) leans slightly positive, especially with announcements of new deals and investments in renewable energy. This includes TotalEnergies winning a 21-year deal to power Google data centers in Malaysia and Morgan Stanley's forecast of positive growth for U.S. utilities due to increased data center power demand. However, there are also negative signals such as Ford's decision to discontinue several electric vehicle projects and the downgrading of Cosan’s outlook to negative. The recency bias suggests that the latest developments might weigh more heavily.",7.5,"After analyzing the news feed, I noticed a mix of positive and negative news, but with a slight bias towards positive news in the last 48 hours. The recent news of the US energy secretary ordering a unit at TransAlta's Centralia coal plant to remain operational through March 2026 and TotalEnergies winning a 21-year deal to power Google data centers in Malaysia are significant positives. However, I applied a recency bias, giving more weight to recent news, which slightly skews the analysis towards a positive outlook.",5.5,"The recent news paints a mixed picture for the Energy sector. While several European and Asian markets closed lower (reflecting broader economic concerns and sector-specific issues like defense and telecom declines), Russia's market showed gains, and there's positive news regarding renewable energy adoption (ReNew, TotalEnergies). The quantitative signal of 0.09 suggests a slightly positive sentiment, and the recent focus on data center power needs and AI-driven demand for chipmaking equipment provides a bullish undercurrent, though Ford's EV strategy shift and Fitch's downgrade of Cosan introduce caution. The recency bias heavily favors the positive developments, particularly the renewable energy deals and AI-related demand.",6.16,Neutral
2025-12-17,Automotive/Manufacturing,1,5.5,"The quantitative signal indicates a negative sentiment (-0.63). However, the most recent news from December 11th shows Elliott Investment Management increasing its stake in Toyota Industries, which could be seen as a positive sign despite the criticism. Given the recency bias where recent news is given 3x more weight, this event slightly tilts the overall sentiment towards neutral considering the significant negative quantitative signal.",2.0,"The news from 2025-12-11 indicates a negative sentiment towards Toyota, potentially affecting the automotive sector. However, since this news is 6 days old, its weight is significantly reduced, and the overall analysis is influenced more by the Quantitative Signal (-0.63), which suggests a bearish trend. Recency Bias is partially mitigated by the older news, but the recent news does not contradict the overall negative trend.",4.5,"The quantitative signal of -0.63 indicates a slightly bearish sentiment. However, the recent news (within the last 48 hours) regarding Elliott Management's increased stake in Toyota Industries and subsequent pressure on Toyota Motor carries significant weight due to the recency bias. This suggests potential challenges and scrutiny for Toyota, which could negatively impact investor confidence in the broader Automotive/Manufacturing sector.",4.02,Neutral
2025-12-17,Other,96,2.5,"The recent news indicates a predominantly negative sentiment, especially with significant drops in stock markets like Australia, Brazil, and Japan, along with specific company warnings and downgrades. However, there are also some positive indicators, such as StubHub's stock rise and Angie Holdings' upsized IPO. Given the recency bias, the latest news about Treasury Wine and FAA chief issues weigh heavily, tilting the overall sentiment towards a slightly negative outlook.",3.5,"Based on the news feed, the overall market sentiment is influenced by recent news with a 3x weightage, indicating a slight bearish trend due to losses in various sectors such as healthcare, energy, and consumer goods. However, the recency bias is evident as recent news from the last 48 hours, such as Treasury Wine Estates' shares slumping to an 11-year low and FAA chief failing to sell Republic shares, contributes to the bearish outlook. Despite this, some positive news like StubHub's stock rising after expanding local partnerships and Emerald Holding's stock surging after confirming acquisition inquiries, suggests a mixed sentiment.",5.0,"The quantitative signal indicates a slightly negative sentiment (-0.01). However, the recent news is mixed. While Australia and Brazil's markets closed lower, Belgium and Indonesia saw gains. The FAA ethics issue and Treasury Wine's slowdown are concerning, but news of StubHub partnerships and Emerald Holding's acquisition interest provide some positive counterpoints. Due to the recency bias, the most recent news (last 24-48 hours) carries more weight, and the mixed signals suggest a cautious outlook.",3.66,Neutral
2025-12-18,Healthcare,140,7.5,"The recent news, especially from the last 48 hours, indicates a strong bullish sentiment in the healthcare sector, with several companies like Medline and DBV Technologies experiencing significant stock surges due to successful IPOs and trial results. However, there are also instances of negative outcomes, such as Insmed Inc. and Vistagen's stock plunges. Despite these negatives, the recency bias suggests that the market sentiment leans more positively due to the larger number of positive events in the recent period.",8.5,"The overall market sentiment for the Healthcare sector is Bullish due to recent positive news from the last 48 hours, such as the successful IPO of Medline, positive trial results for various drugs, and the approval of several new treatments. The recent news has given more weight to the analysis, with a 3x emphasis on recent developments. However, some negative news, such as the failure of Insmed's Phase 2b study, has been outweighed by the positive news, indicating a strong overall sentiment.",8.2,"The recent news paints a generally positive, albeit complex, picture for the healthcare sector. The soaring IPOs of Medline (multiple mentions, significant percentage increases) and DBV Technologies, alongside positive trial results for several companies (Vyne, Compugen, Avacta, Immunome, Radiopharm, BioCryst, AC Immune, Rhythm, Atossa, Valneva, Biohaven, Corbus, Zealand, and Eli Lilly), strongly suggest investor enthusiasm. However, negative news like Insmed's failed trial, Kyverna's share offering impact, Vistagen's trial failure, UBS downgrading Swiss Re, and concerns about HCA Healthcare’s valuation introduce caution. The recent focus on drug pricing deals with the White House and GLP-1 drug market debate add further complexity, but the overwhelmingly positive momentum from IPOs and clinical trial successes, heavily weighted due to recency bias, leans towards a bullish sentiment.",8.06,Bullish
2025-12-18,Communication Services,85,5.5,"The recent news indicates a mix of positive and negative developments, but there is a notable trend towards consolidation and expansion within the Communication Services sector. Recent news, given more weight due to recency bias, shows several companies making strategic moves such as partnerships, acquisitions, and expansions into new markets, which generally signals optimism. However, some negative factors like regulatory scrutiny and market closures temper this optimism.",8.2,"After analyzing the news feed, I noticed a recency bias towards the last 48 hours, giving more weight to recent news. The sector appears to be driven by various factors, including the expansion of services by companies like Coinbase and Netflix, as well as the rise of new technologies and partnerships. However, some news, such as the decline of Saudi Arabia's stock market and the ban on Roblox in Russia, indicate potential challenges.",8.2,"The recent news paints a generally positive picture for the Communication Services sector. Several key developments, particularly in the last 48 hours, highlight growth and innovation: YouTube securing the Oscars, Netflix expanding into gaming, and positive analyst upgrades for Roku and iHeartMedia. While Telefonica's delisting and regulatory scrutiny create some headwinds, the overall sentiment is driven by expansion, partnerships, and technological advancements. The recency bias significantly impacts this assessment, as the most recent news is overwhelmingly positive.",7.28,Bullish
