Report_Date,Sector,News_Volume,Score_Qwen,Reason_Qwen,Score_Llama,Reason_Llama,Score_Gemma,Reason_Gemma,Final_Daily_Score,Final_Outlook
2025-12-31,Financials,129,8.5,"The recent news from the last 48 hours predominantly indicates strong performance and positive trends in various financial sectors, such as AI investments and robust stock market gains. This recent positive trend outweighs older news with mixed signals. The recency bias significantly influences the overall sentiment towards a positive outlook.",8.5,"The market sentiment for 'Financials' as of 2025-12-31 is Bullish due to recent news indicating a strong AI boom in technology sectors, significant investments in AI technology, and a surge in precious metals. Recent news from the last 48 hours, such as SoftBank's $41 billion investment in OpenAI, Air China's $9.5 billion Airbus purchase, and Nvidia's $5 billion investment in Intel, have given 3x more weight to the overall analysis. However, some news from the last 48 hours, such as Fitch downgrading Braskem's credit rating and OceanFirst Financial's stock falling after announcing a merger, have introduced some caution, but overall the sector remains optimistic.",8.5,"The recent news overwhelmingly points towards a bullish sentiment for the Financials sector. The dominant theme is the AI boom, with multiple articles highlighting investments in AI (SoftBank's $41 billion investment in OpenAI, Nvidia's acquisition talks with AI21 Labs, and Asian stock gains driven by AI). The quantitative signal of 0.24 further supports this positive outlook. The recency bias significantly impacts this assessment, as the most recent news heavily emphasizes AI-driven growth, overshadowing concerns about trade jitters or potential rate cuts.",8.5,Bullish
2025-12-31,Industrials,48,8.5,"The recent news from the last 48 hours shows a strong trend of positive developments in the Industrials sector, including major defense contracts, aircraft orders, and strategic partnerships. However, there are also negative incidents like the Ukrainian drone attack and a few company-specific issues. The recency bias indicates that the most recent positive events weigh heavily, contributing to an overall bullish sentiment.",8.2,"After analyzing the news feed, I found that recent news (from the last 48 hours) has a significant impact on the overall sentiment, with 3x more weight given to these articles. The recent news includes positive developments such as Lockheed Martin securing $500 million in defense contracts, Saab securing a $1.34 billion order from France, and SoftBank completing a $40 billion investment in OpenAI. However, some negative news, like the Ukrainian drone attack on the Tuapse refinery, also occurred recently, but its impact is somewhat mitigated by the overall positive tone of recent news.",8.5,"The recent news heavily favors a bullish outlook for the Industrials sector. The most recent headlines (Dec 29-31) are overwhelmingly positive, featuring significant contract wins for defense companies like Lockheed Martin and Saab, substantial aircraft orders for Airbus and Air China, and strategic partnerships boosting companies like Dot Ai and Nuburu. While the CSX train derailment and Tesla's battery material contract reduction introduce some negative sentiment, the sheer volume of positive news, particularly the large contract values and strategic partnerships, outweighs these concerns. The recency bias significantly impacts this assessment, as the most recent data points strongly suggest upward momentum.",8.4,Bullish
2025-12-31,Communication Services,28,8.5,"The recent news, especially from the last 48 hours, highlights significant investments in AI and technology within the Communication Services sector, such as ByteDance's planned expenditure on Nvidia AI chips and Meta's acquisition of Manus. These developments outweigh negative events like the Ukrainian drone attack and stock declines, demonstrating a strong focus on innovation and growth. The recency bias indicates a positive trend towards technological advancements and strategic investments.",8.2,"The Communication Services sector's market sentiment is predominantly influenced by recent news, with a recency bias towards the last 48 hours. The sector's outlook is driven by significant investments in AI technologies, such as ByteDance's $14 billion deal with Nvidia and Meta's acquisition of Manus, indicating a strong focus on innovation. However, concerns about regulatory scrutiny, as seen in the Poland's request to investigate TikTok, temper the overall sentiment.",8.5,"The recent news heavily emphasizes the Communication Services sector's strong connection to Artificial Intelligence (AI). ByteDance's massive investment in Nvidia chips, Meta's acquisition of Manus, and Nvidia's potential acquisition of A21 Labs all point towards significant growth and innovation within the space. The quantitative signal of 0.14 further supports a positive sentiment, and while there are some negative headlines (Meta lawsuits, Walmart outages, Saudi Arabia market decline), the overwhelming narrative is one of AI-driven expansion and investment, with a strong recency bias due to the focus on the last 48 hours of news.",8.4,Bullish
2025-12-31,Healthcare,59,7.5,"The recent news from the last 48 hours, given triple weight, includes positive developments such as price reductions for weight-loss drugs in China and a potential takeover target highlighting, which positively impacts market sentiment. However, there are also negative signals like stock falls due to insider sales and reverse splits. Overall, the positive news slightly outweighs the negatives, influenced significantly by the recency bias.",8.2,"The overall sentiment for the Healthcare sector is Bullish due to recent positive news such as the approval of new treatments, partnerships, and expansions. However, the Recency Bias impact is significant, with recent news carrying 3x more weight, which skews the analysis towards a more positive outlook. Despite some negative news, the overall trend suggests a positive direction for the sector.",8.5,"The recent news paints a mixed, but ultimately positive, picture for the healthcare sector. While there are instances of stock declines due to factors like reverse stock splits, insider sales, and clinical trial failures (Verastem, Genmab, Inovio), these are offset by significant positive developments. Crucially, the most recent news (past 48 hours) highlights price cuts for weight-loss drugs (Novo Nordisk, Lilly), positive FDA decisions (Agios, Repare), and bullish investment activity (Achieve Life Sciences), all heavily weighted due to recency bias. The overall trend suggests improving accessibility, innovation, and investor confidence.",8.06,Bullish
2025-12-31,Utilities,44,7.5,"The recent news feed shows a positive trend towards utilities, particularly with announcements like Duke Energy's early site permit submission for a potential nuclear site and Octopus Energy's spin-off of Kraken Technologies. These events carry significant weight due to recency bias. However, there are also negative indicators such as New Era Energy's stock plunge due to a fraud lawsuit. Overall, the positive signals slightly outweigh the negatives, indicating a generally favorable sentiment.",8.2,"After analyzing the news feed, it is evident that the Utilities sector has been positively impacted by recent news, such as the expansion of AI compute power, potential acquisitions, and collaborations, which have contributed to a Bullish outlook. However, older news, like the New Era Energy stock plunge due to a fraud lawsuit, has been given less weight due to the 3x recency bias. This recency bias has led to a slight emphasis on the recent positive developments, resulting in a Bullish outlook.",8.5,"The recent news heavily favors a bullish outlook for Utilities. Several companies within the sector (DevvStream, T1 Energy, Cango, FTAI Aviation, PowerBank, Eastern International) have experienced significant stock increases due to collaborations, investments, and contract wins, particularly in renewable energy and nuclear power. The quantitative signal of 0.35 further supports this positive sentiment, and the recency bias given to the last 48 hours of news amplifies the impact of these positive developments, outweighing the few negative mentions like RBC downgrading DigitalBridge and New Era Energy's legal issues.",8.06,Bullish
2025-12-31,Real Estate,11,7.5,"The most recent news from the past 48 hours shows Saudi Arabia's stock market closing lower, which might indicate broader economic concerns but does not specifically target real estate. However, the significant positive news about Blackstone-backed Bagmane Prime Office REIT filing for a large IPO and AirTrunk considering a Singapore REIT listing suggests strong interest in real estate investments. This positive trend outweighs the negative signals from other sectors and older news, demonstrating a recency bias towards bullish sentiment.",7.5,"The market sentiment for Real Estate as of 2025-12-31 is influenced by a mix of news, with recent developments such as the potential REIT listing by AirTrunk and the acquisition of Supermarket Income REIT and Roadside Real Estate, indicating a positive trend. However, older news, including the downgrade of China Vanke and the decline in Saudi Arabia's stock market, suggests a more cautious outlook. Recency Bias is evident, with recent news carrying 3x more weight, leading to a slightly bullish overall sentiment.",8.5,"The quantitative signal of 0.25 suggests a mildly positive sentiment. Recent news (within the last 48 hours) is overwhelmingly positive, with multiple REITs filing for IPOs (Bagmane Prime Office REIT, AirTrunk considering a listing), acquisitions happening (Supermarket Income REIT, Roadside Real Estate), and deals being finalized (PAG and KKR acquiring Sapporo Real Estate). The Saudi Arabia stock market decline is a minor negative, but the strong REIT activity and UK market gains outweigh this, especially considering the recency bias applied to the most recent data.",7.83,Bullish
2025-12-31,Basic Materials,61,7.5,"The recent news, especially within the last 48 hours, indicates a positive sentiment towards Basic Materials, with several indices and individual stocks showing gains. This includes the TSX, OMX Stockholm 30, and other regional indices. However, there are some negative events such as the CSX derailment and declines in certain markets like Japan and Australia. Given the recency bias, the positive signals outweigh the negatives.",7.2,"Based on the news feed, the Basic Materials sector is experiencing a mix of positive and negative news, with recent news from the last 48 hours giving 3x more weight. The news of Korea Zinc revising its share issuance for a US smelter and Jefferies predicting the S&P 500's metals and mining sector to outperform in 2026 are bullish indicators. However, the recent news of a CSX train derailment and the decline in the TSX due to a correction in the commodities sector are bearish indicators. Recency Bias impacts the analysis by giving more weight to recent news, which suggests a slightly bullish outlook. However, the overall sentiment remains mixed.",8.5,"The most recent news (past 48 hours) paints a predominantly positive picture for the Basic Materials sector. We see record highs in European and Swedish markets, driven by gains in basic resources and mining shares, alongside rising gold and silver prices. While a CSX train derailment involving sulfur is concerning, the overall trend, amplified by the recency bias, suggests strong investor confidence and demand within the sector, particularly for critical minerals and precious metals.",7.73,Bullish
2025-12-31,Energy,62,7.5,"The most recent news shows mixed signals but leans positive, with several companies announcing expansions and collaborations in the energy sector. However, the Ukrainian drone attack on the Tuapse refinery introduces geopolitical risk. Given the recency bias, the positive trends in stock performance and corporate actions outweigh the negative event, indicating a generally positive sentiment towards the energy sector.",8.2,"Based on the news feed, the market sentiment for 'Energy' as of 2025-12-31 is influenced by recent news, with a recency bias towards the last 48 hours. The weighted analysis suggests a mixed outlook, with positive news from companies like DevvStream, T1 Energy, and Energy Fuels, but also negative news from Ukraine's drone attack on the Tuapse refinery. However, the overall sentiment is leaning towards a bullish trend due to the recent surge in oil and gas stocks in Russia and other countries.",7.5,"The most recent news (within the last 48 hours) paints a mixed, but ultimately slightly positive, picture for the Energy sector. The drone attack on the Tuapse refinery is a negative event, but it's balanced by several positive indicators: rising stock markets in Russia, Sweden, Italy, Israel, and the Netherlands, all with significant Oil & Gas sector gains. Furthermore, news of DevvStream, FTAI Aviation, T1 Energy, and Eastern International securing investments or collaborations, alongside Energy Fuels exceeding production guidance and BP's sale of Castrol, suggests ongoing activity and potential growth. The recency bias heavily favors the positive developments, as they reflect the current market sentiment.",7.73,Bullish
2025-12-31,Other,52,5.5,"The majority of the recent news (last 48 hours) indicates positive performance in various global markets, with several indices closing higher. This includes Taiwan, Portugal, Brazil, and Morocco, which have seen significant gains. However, there are also negative signals, such as Colombia's stock market decline and individual company stock drops. Given the recency bias, the positive trends in the most recent data carry more weight, but the overall sentiment remains mixed.",8.2,"After analyzing the news feed, I noticed that recent news (last 48 hours) has a significant impact on the overall sentiment, with a 3x weightage. The recent news suggests a positive trend in various markets, such as Taiwan, Germany, and Portugal, with some fluctuations in other markets like Indonesia and India. However, the overall sentiment remains positive due to the recent news, despite some negative news from older dates.",7.5,"The quantitative signal of 0.21 suggests a slightly positive sentiment. Recent news (last 48 hours) shows a mixed bag, with Taiwan's market hitting an all-time high and Colombia's declining. However, due to the recency bias, the positive news from Taiwan and the general trend of positive closes in several European and Asian markets outweighs the negative signals, indicating a cautiously optimistic outlook. ",7.05,Bullish
2025-12-31,Consumer Defensive,23,5.5,"The recent news from the past 48 hours does not specifically target the Consumer Defensive sector but indicates overall market stability and some positive trends. The quantitative signal of 0.40 suggests a slightly positive sentiment. However, there is no direct contradiction between recent and older news regarding the Consumer Defensive sector, implying a consistent sentiment. The recency bias slightly elevates the importance of the most recent news, which includes general market stability and some positive movements.",8.2,"The analysis of the Consumer Defensive sector as of 2025-12-31 is influenced by recent news, with a recency bias given to the last 48 hours of news. The sector appears to be driven by positive developments, such as Meta's acquisition of Manus, Advanced Biomed's stock rise, and JPMorgan's top consumer stocks picks for 2026. However, older news, like the approval of appetite-suppressing GLP-1 pills, may have a mixed impact on the sector's outlook.",7.5,"Recent news heavily favors a bullish outlook for the Consumer Defensive sector. The most recent headlines (within the last 48 hours) show positive developments like Davis Commodities' expansion into China, Nutriband and Society Pass stock surges, and JPMorgan's identification of top consumer stocks for 2026. While Target faces activist pressure and Sobr Safe experienced a stock drop, the overall trend, amplified by recency bias, points towards positive sentiment. The weight of the recent positive news outweighs the negative, suggesting a strengthening sector.",7.05,Bullish
2025-12-31,Consumer Cyclical,53,5.5,"The recent news predominantly highlights mixed signals but leans slightly positive, with notable mentions of stock price increases and acquisitions. However, there are also negative indicators like drops in deliveries and legal issues. Given the recency bias, the latest news about Tesla's delivery drop and Disney's legal settlement carry more weight, yet they are balanced by positive developments such as REE Automotive's stock jump and VinFast's IPO plans. Overall, the sentiment is cautiously optimistic.",5.2,"The analysis of the Consumer Cyclical sector is heavily influenced by recent news, with a 3x weightage given to news from the last 48 hours. The sector is experiencing a mix of positive and negative news, with recent developments such as Tesla's 15% drop in Q4 deliveries and Disney's $10 million settlement weighing on the sector, while other news like Xpeng's expansion into Qatar and ECD Automotive Design's product lineup expansion are positive. However, recency bias plays a significant role in this analysis, as recent news tends to have a greater impact on market sentiment.",5.5,"The quantitative signal of 0.17 suggests a slightly positive sentiment. Recent news paints a mixed picture: Tesla's delivery drop and Hyundai's inability to buy back their Russian factory are negative, while REE Automotive's stock jump and Randian Capital's interest in Clear Secure are positive. However, the recency bias heavily favors the more recent news, and the overall tone leans slightly positive, particularly with Wolfe Research's preference for the Technology sector and Society Pass's stock surge. The Lululemon proxy fight and DOJ investigations add some uncertainty, but the positive signals outweigh the negatives.",5.4,Neutral
2026-01-01,Industrials,52,8.5,"The recent news indicates a strong trend of positive developments within the Industrials sector, especially in aerospace and defense, with large contract awards and acquisitions driving momentum. However, there are some negative events, such as a train derailment and a significant drop in a Tesla supplier's contract value. Given the recency bias, the most recent positive news from the last 48 hours, like the Boeing contract and Transdigm's acquisition, carry more weight, suggesting an overall positive sentiment.",8.2,"After analyzing the news feed, it's evident that the Industrials sector has been impacted by a mix of positive and negative news. Recent news, given 3x more weight, suggests a Bullish trend, with several defense contracts and acquisitions driving growth. However, older news, such as the train derailment and drone attack, may have had a short-term negative impact, but their influence is diminished by recency bias.",8.5,"The recent news feed is overwhelmingly positive for the Industrials sector. We see significant contract awards for Boeing and Lockheed Martin, acquisitions driving growth for TransDigm and Rubico, and positive developments for companies like Ondas, Laser Photonics, and Visionary Education. The strong emphasis on defense contracts (Boeing, Lockheed Martin, Saab) combined with AI and drone industry growth (Top 5 Drone Stocks, Brookfield's AI chip leasing, JetAI) paints a bullish picture. Due to the recency bias, the news from the last 48 hours carries significant weight, further solidifying a positive sentiment.",8.4,Bullish
2026-01-01,Technology,81,8.5,"The recent news indicates a strong emphasis on AI and semiconductor advancements, with multiple large acquisitions and investments in AI infrastructure. However, there are also some negative signals such as downgrades and rejections. Given the recency bias, the positive news from the last 48 hours, particularly regarding Nvidia's expansion and SoftBank's investment in OpenAI, carries significant weight, overshadowing the negatives.",8.2,"Based on the news feed, the Technology sector appears to be Bullish, with a strong emphasis on AI and chip manufacturing. Recent news from the last 48 hours, such as Nvidia's $20 billion deal with Groq and Samsung's plans to mass-produce HBM4 for Nvidia AI chips, has given significant weight to the positive sentiment. However, the Recency Bias has also led to a slight overemphasis on recent news, potentially downplaying the impact of older news, such as the FDA's rejection of Outlook Therapeutics' application.",8.5,"The recent news heavily favors a bullish outlook for the Technology sector. The overwhelming majority of recent headlines (within the last 48 hours) highlight significant investments in AI, increased demand for AI chips (Nvidia, TSMC), and positive developments like SoftBank's OpenAI investment and Brookfield's cloud business launch. While Wedbush downgraded GlobalFoundries, the overall trend indicates strong growth and innovation, with a clear recency bias impacting the assessment due to the weighting applied to recent events.",8.4,Bullish
2026-01-01,Energy,60,7.5,"The most recent news indicates positive trends in the energy sector, such as the appointment of Harbour Energy as the operator of the Zama oil project in Mexico and JPMorgan updating its focus list for energy stocks. However, there are also negative events like the Ukrainian drone attack on the Tuapse oil refinery. Given the recency bias, the positive news from the last 48 hours carries more weight, suggesting a generally positive outlook for the energy sector.",8.2,"The analysis of the market sentiment for 'Energy' as of 2026-01-01 reveals a Bullish outlook due to recent positive news such as Harbour Energy being appointed as the operator of the Zama oil project in Mexico, Tesla beginning Cybercab production testing, and Energy Fuels exceeding its 2025 uranium production and sales guidance. However, older news such as the Ukrainian drone attack on the Tuapse oil refinery in Russia and the rejection of Petrobras's proposal to end a strike in Brazil have a lower weight due to recency bias. The weighted analysis suggests that the recent positive news outweighs the negative news.",8.5,"The quantitative signal of 0.37 suggests a slightly positive sentiment. Recent news (last 48 hours) is overwhelmingly positive, with JPMorgan highlighting energy stocks, India's market showing gains in the Oil & Gas sector, Harbour Energy securing a major project, and Energy Fuels exceeding production targets. The impact of recency bias is significant here, as the most recent data strongly indicates positive momentum despite some minor negative news like the Tuapse refinery attack and the New Era Energy lawsuit.",8.06,Bullish
2026-01-01,Basic Materials,56,7.5,"The recent news indicates a mixed sentiment, but there is a stronger emphasis on positive developments within the basic materials sector over the past 48 hours, such as East Star Resources confirming deep mineralization and Korea Zinc revising its share issuance for a U.S. smelter. These positive signals outweigh the broader market declines seen in the U.S. and Canada, demonstrating a recency bias towards a more optimistic outlook.",8.2,"The Basic Materials sector appears to be Bullish due to recent news of East Star Resources confirming deep mineralization at Verkhuba, Korea Zinc revising its share issuance for a U.S. smelter, and Jefferies predicting the S&P 500's metals and mining sector will continue to outperform in 2026. However, recent news also includes declines in the Basic Materials sector in Canada and Australia, which could be a sign of a correction. Recency bias is applied, giving more weight to news from the last 48 hours, which suggests a Bullish trend.",8.2,"The recent news paints a mixed but ultimately positive picture for the Basic Materials sector. While some markets like the U.S. and Canada saw slight declines, several key indicators point to strength: European and Swedish markets hit record highs, driven by basic resources and materials. The significant news regarding Korea Zinc's smelter investment, East Star Resources' mineral discoveries, and Fresnillo's share rise due to silver's record high, coupled with Jefferies' positive outlook, strongly suggest upward momentum. The recency bias heavily favors the positive signals from the last 48 hours, outweighing the minor negative movements.",7.96,Bullish
2026-01-01,Defense,1,7.5,"The most recent news indicates a significant defense contract awarded to Lockheed Martin, which positively impacts the defense sector sentiment. Given the recency bias, this news carries substantial weight despite the quantitative signal suggesting a slightly negative sentiment. The overall sentiment leans positive due to the high-value contract.",8.1,"The market sentiment for 'Defense' as of 2026-01-01 is influenced by recent news of a $328.5 million contract awarded to Lockheed Martin by the Pentagon for military equipment supply to Taiwan. This news, given its recency bias (3x weight), significantly impacts the overall analysis, outweighing any potential contradictory information from older news. The recent news is a positive indicator for the sector, suggesting a Bullish outlook.",7.5,"The quantitative signal of 0.27 indicates a slightly positive market sentiment. The only available news item, dated December 31, 2025, reports a significant contract award to Lockheed Martin from the Pentagon for military equipment to Taiwan. Due to the recency bias, this single, positive news event carries significant weight, suggesting increased demand and investment in the defense sector.",7.7,Bullish
