Report_Date,Sector,News_Volume,Score_Qwen,Reason_Qwen,Score_Llama,Reason_Llama,Score_Gemma,Reason_Gemma,Final_Daily_Score,Final_Outlook
2025-12-23,Financials,371,5.5,"The recent news indicates a mix of positive and negative signals, but the majority of the recent news (within the last 48 hours) leans positive. Key positive signals include upgrades in credit ratings for several financial firms, successful mergers, and positive outlooks from analysts. However, there are also negative signals such as bankruptcy considerations and downgrades. The recency bias suggests that the recent positive news slightly outweighs the older negative news.",5.5,"After analyzing the news, I found that the Financials sector is experiencing a mix of positive and negative news. The recent news from the last 48 hours, such as the upgrade of several financial companies' credit ratings and the successful IPO of Medline, has a 3x weightage. However, older news, such as the downgrade of several companies' credit ratings and the challenges faced by the sector, still holds some weight. Recency bias suggests that recent news should have a greater impact, but the overall sentiment remains mixed. Therefore, I conclude that the sector is experiencing a neutral outlook.",7.5,"The most recent news (Dec 22-23, 2025) paints a mixed but generally positive picture for the 'Financials' sector. While gold stocks face challenges despite record gold prices, broader market sentiment is leaning positive, with Asian markets rising and precious metals increasing. The quantitative signal of 0.33 further supports a slightly bullish outlook, and the numerous upgrades and positive outlook revisions for companies like Amgen, Xylem, and Medtronic indicate underlying financial strength. The recency bias heavily favors the positive news from the last 48 hours, outweighing older, more nuanced reports.",6.16,Neutral
2025-12-23,Consumer Defensive,70,5.5,"The recent news from the past 48 hours includes upgrades for Teva Pharmaceuticals and Rentokil, indicating positive momentum. However, Saks Global's consideration of bankruptcy and Jim Beam's plan to pause production suggest some underlying issues. The overall sentiment leans slightly positive due to the recency bias favoring the upgrades and optimistic outlooks.",7.5,"The Consumer Defensive sector is influenced by recent news on Saks Global's potential bankruptcy, which is a negative indicator. However, other news, such as Teva's upgrade to 'BB+' and Loop's upgrade of Ollie's Bargain Outlet, suggest a more positive outlook. Considering the recency bias, recent news from the last 48 hours, such as Kraft Heinz's appointment of a new CEO and Jefferies' upgrade of P&G and Church & Dwight, have a significant impact on the overall sentiment, leaning towards a more positive outlook.",5.5,"The recent news paints a mixed picture for the Consumer Defensive sector. While Saks Global's potential bankruptcy is a significant negative, Teva's upgrade and Loop Capital's positive assessment of Ollie’s Bargain Outlet offer some counter-balance. Due to the recency bias, the most recent news (last 48 hours) carries significant weight; the Jim Beam production pause and the negative impact of Trump tariffs on German auto exports are concerning, but the overall sentiment isn't overwhelmingly negative, especially considering the upgrades and positive outlooks for some companies.",6.16,Neutral
2025-12-23,Other,125,5.5,"The recent news indicates a mixed sentiment, but with a slight bias towards positive developments, especially in the last 48 hours. Recent news includes a $50 million contract modification for Northrop Grumman, which is a positive signal for defense contractors. However, there are also negative signals such as the resignation of Tory Bruno and the explosion at the Elkem chemical plant. The recency bias slightly tilts the balance towards a neutral to slightly positive outlook.",7.2,"After analyzing the news feed, I noticed that recent news (last 48 hours) has a significant impact on the overall sentiment, with 3x more weight given to these articles. The recent news is mixed, with some positive developments such as the US Navy's plan to build a new class of warship and the strong performances of various stock markets, but also negative news like the explosion at an Elkem chemical plant in France and the decline in some stock markets. However, the overall sentiment is slightly leaning towards a positive outlook due to the recent news, despite the recency bias.",5.5,"The quantitative signal of 0.13 suggests a slightly positive sentiment. Recent news is mixed, with some European markets declining (U.K., Netherlands, Belgium, France) while others rise (Finland, Mexico, Colombia, Morocco, Indonesia). However, the Northrop Grumman contract modification and Ellison's personal guarantee for Paramount indicate positive developments in specific sectors. The recency bias heavily favors the mixed signals from the last 48 hours, making a definitive bullish or bearish assessment challenging.",6.06,Neutral
2025-12-23,Energy,157,7.5,"The recent news, especially from the last 48 hours, indicates a mix of positive and negative developments within the energy sector. However, the most recent and impactful news involves Alphabet's acquisition of Intersect for $4.75 billion, which signals a significant investment in clean energy. Additionally, the U.S. government's decision to halt offshore wind projects is a negative factor, but it is outweighed by the overall trend of increased investment in renewable and clean energy technologies. Recency bias suggests that the latest news has a stronger influence, thus tilting the balance slightly towards a positive outlook.",5.5,"After analyzing the news feed, I found that the recent news (last 48 hours) indicates a mixed sentiment with some positive developments such as Alphabet's acquisition of Intersect for $4.75 billion to bolster its infrastructure for artificial intelligence and TotalEnergies' 21-year deal to power Google data centers in Malaysia. However, there are also negative news such as the U.S. government's decision to temporarily halt construction on large-scale offshore wind projects due to national security concerns, which contradicts the positive sentiment. Considering the recency bias, I gave more weight to recent news, but the overall sentiment remains mixed.",4.5,"The quantitative signal of 0.29 suggests a slightly positive sentiment. Recent news is mixed, but leans negative due to the U.S. offshore wind stop-work order impacting Dominion Energy and offshore wind stocks generally, alongside China Vanke's debt concerns. However, positive news includes Australia's stock market gains, Alphabet's acquisition of Intersect (clean energy), and T1 Energy securing a solar module deal, alongside gains in Poland and Sweden. The recency bias heavily favors the negative news regarding the wind project suspension, which outweighs the more dispersed positive signals.",5.85,Neutral
2025-12-23,Media,1,5.5,"The most recent news indicates that Warner Bros Discovery's board has rejected a significant hostile takeover bid from Paramount Skydance, which could suggest stability or resistance against major changes in the media landscape. However, given the negative quantitative signal (-0.58), there seems to be an overall bearish sentiment towards the media sector. The recency bias slightly tilts the balance towards a more neutral stance due to the rejection of the takeover bid, but the long-term trend remains negative.",2.0,"The news from 2025-12-17 indicates a negative sentiment towards Warner Bros Discovery, but due to the recency bias, I've given it less weight. However, the overall sentiment remains negative as there is no contradicting news from the last 48 hours. This suggests a consistent negative trend.",5.5,"The provided quantitative signal of -0.58 suggests a slightly negative market sentiment. However, the recent news regarding Warner Bros Discovery rejecting a significant hostile bid from Paramount Skydance carries substantial weight due to the recency bias. While the bid was rejected, the fact that a $108.4 billion offer was even made indicates strong interest and potential value within the media sector, overriding the negative quantitative signal.",4.35,Neutral
2025-12-24,Transportation,2,8.5,"The most recent news from December 18th indicates a positive outlook for the U.S. airline sector and airport acquisitions, which supports the existing quantitative signal of 0.72. Given the recency bias, these latest updates carry significant weight, reinforcing the overall positive sentiment without any contradicting information from earlier dates.",8.5,"The analysis of the news feed reveals a Bullish sentiment for the Transportation sector, with recent news from Wells Fargo favoring United and Delta airlines outweighing the acquisition of stakes in Leeds Bradford and Newcastle airports by Aena. The recency bias, giving 3x more weight to news from the last 48 hours, amplifies the positive sentiment from Wells Fargo's outlook, as it is more recent than the airport acquisition news. This suggests that the market is currently leaning towards a positive outlook for the sector.",8.5,"The quantitative signal of 0.72 indicates a generally positive sentiment. Recent news (within the last 48 hours) is overwhelmingly positive, with Wells Fargo expressing a constructive outlook on U.S. airlines and Aena's airport acquisitions signaling expansion and investment. Due to the recency bias, the positive news significantly outweighs any potential concerns, leading to a bullish assessment.",8.5,Bullish
2025-12-24,Basic Materials,65,8.5,"The recent news from the past 48 hours indicates a generally positive trend for basic materials, with stocks rising and strong performances noted across various regions. However, there are also some negative signals, such as the downgrade of Adecoagro and the decline in KGHM Polska Miedz's shares. The recency bias suggests that the latest positive trends in basic materials outweigh the negatives, contributing to an overall bullish sentiment.",8.2,"After analyzing the news feed, I found that recent news (last 48 hours) has a 3x weightage. The news from the last 48 hours is generally positive for the Basic Materials sector, with gold and silver prices reaching record highs, and several companies in the sector performing well. However, older news from 4-5 days ago is mixed, with some companies facing challenges, but overall, the recency bias towards recent positive news tips the scale towards a bullish outlook.",7.5,"The most recent news (past 48 hours) paints a generally positive picture for Basic Materials. We see gains in U.K. and Canadian markets driven by industrial metals, precious metals, and mining stocks, alongside record highs for gold. While Moody's downgrade of Adecoagro introduces a negative element, the overall trend, especially with the quantitative signal of 0.40, suggests upward momentum. The recency bias heavily favors the positive signals from the last two days.",8.07,Bullish
2025-12-24,Consumer Cyclical,152,8.5,"The recent news shows a predominantly positive trend for the Consumer Cyclical sector, with several companies reporting strong performances, acquisitions, and positive analyst ratings. However, there are also some negative signals, such as recalls and sales declines. Given the recency bias, the most recent positive developments outweigh the older negative ones, indicating a generally positive sentiment.",8.2,"The Consumer Cyclical sector appears to be Bullish, driven by recent positive news from the last 48 hours, such as the S&P 500 reaching a new record close due to strong performance from large technology companies, and Visa reporting a 4.2% year-over-year increase in U.S. holiday spending. This recent news outweighs the negative news from earlier, such as Tesla's projected decline in Q4 deliveries and Nike's sales warning. Recency bias plays a significant role in this analysis, as recent news has a 3x greater weight.",7.5,"The recent news paints a mixed but ultimately positive picture for Consumer Cyclical stocks. While there are concerns like Tesla's delivery miss, Coty's execution risks, and Mothercare's sales decline, these are offset by positive signals such as Visa's strong holiday spending report, retail investor influence, Dollar store resilience, and positive performance in Mexico and Australia's stock markets. The quantitative signal of 0.15 also supports a slightly positive outlook. Due to the recency bias, the most recent news (last 48 hours) carries significantly more weight, and the overall trend leans towards optimism.",8.07,Bullish
2025-12-24,Technology,220,7.5,"The recent news (within the last 48 hours) indicates a mix of positive and negative developments, but the overall sentiment leans positive due to significant announcements like the inclusion of UiPath in the S&P MidCap 400 index, the potential AI-driven growth for Microsoft, and the strong performance of AI-related stocks. However, there are also regulatory setbacks and legal issues, such as the FDA complete response letter for Sanofi's drug and the FTC investigation into Instacart's AI pricing tool. The recency bias suggests that the latest news about AI growth and stock performance is more influential.",8.2,"The overall sentiment for the Technology sector is Bullish due to the recent surge in AI-related news, with many companies announcing partnerships, investments, and advancements in AI technology. However, the sector's growth is not without its challenges, as some companies face regulatory setbacks and declining demand. Despite this, the recent news suggests that the sector is poised for continued growth, with many companies making significant strides in AI development and adoption.",8.2,"The most recent news (past 48 hours) paints a generally positive picture for the Technology sector. While Sanofi's FDA setback and JetAI's data center venture issues are negative, they are outweighed by positive developments like UiPath's index inclusion, Nvidia's strong performance driving the S&P 500 to a record, Apple's regulatory settlements, and strong forecasts from RBC and Morgan Stanley. The recency bias heavily favors the positive momentum, particularly the AI-driven growth and investment trends.",7.96,Bullish
2025-12-24,Healthcare,132,7.5,"Recent news indicates a mixed sentiment but leans slightly positive, with several companies receiving FDA approvals and stock surges following positive developments. However, there are also setbacks and regulatory issues that temper the overall optimism. The recency bias suggests that the latest FDA approvals for Novo Nordisk and others have a significant positive impact, outweighing the negative news.",8.5,"After analyzing the news feed, it's evident that the recent news (last 48 hours) has a significant impact on the overall sentiment. The news from the last 48 hours, such as Novo Nordisk's approval of their GLP-1 weight-loss pill, the FDA approval of Agios Pharmaceuticals' thalassemia treatment, and the European shares reaching a new record high, have a 3x weightage in the analysis. This recency bias suggests that the market is currently optimistic about the healthcare sector, with several positive developments in the last 48 hours.",7.5,"The recent news feed presents a mixed picture for the healthcare sector. While there are setbacks like Sanofi's FDA rejection and concerns about Obamacare enrollment, significant positives emerge, particularly Novo Nordisk's FDA approvals for both Wegovy and its oral GLP-1 pill, driving European and Norwegian stock markets. The quantitative signal of 0.28, coupled with the recent positive news regarding Novo Nordisk and Agios Pharmaceuticals, suggests a cautiously optimistic outlook, with the recency bias heavily influencing the overall sentiment.",7.83,Bullish
2025-12-24,Industrials,166,7.5,"The recent news indicates a predominantly positive trend in the Industrials sector, especially with significant defense contracts and acquisitions. However, there are some negative signals such as the pushback against mergers and the rejection of certain deals. The recency bias suggests that the latest news, particularly the successful IPO filings and defense contracts, carry more weight, tilting the overall sentiment slightly positive.",8.2,"The Industrials sector is showing a Bullish trend due to recent positive news from the last 48 hours, such as the awarding of major defense contracts to companies like Lockheed Martin and Raytheon, and the successful IPO of companies like Medline Inc. and Velo3D. However, older news from the past week also highlights the sector's growth potential, including the expansion of European airlines and the increasing demand for renewable energy. The Recency Bias impact is significant, as recent news carries more weight in this analysis.",7.5,"The recent news paints a mixed but ultimately positive picture for the Industrials sector. While the BlackRock ports deal risk and F-35 operational issues introduce some uncertainty, the overwhelming trend is positive, with significant contract awards to Raytheon and Boeing, a strong IPO for Motive Technologies, and positive order trends for Ametek. The quantitative signal of 0.41 further supports a slightly bullish sentiment. The recency bias heavily favors the positive news from the last 48 hours, outweighing older concerns.",7.73,Bullish
2025-12-24,Communication Services,79,7.5,"The recent news shows a mix of positive and negative signals, but there is a notable bullish trend in the last 48 hours, particularly with RBC upgrading the Communication Services sector and several companies like Silynxcom and Beamr Imaging reporting positive developments. This recency bias indicates a stronger current sentiment towards the sector.",8.2,"The Communication Services sector is leaning towards a Bullish outlook due to recent positive news, such as the inclusion of UiPath in the S&P MidCap 400 index and the rise of Roku's stock after an expanded partnership with Nielsen. However, older news, like the decline in Obamacare enrollment and the cyberattack on Kuaishou, had a negative impact. Recency bias plays a significant role in this analysis, giving more weight to recent news, which ultimately tips the scale towards a Bullish outlook.",7.5,"The recent news paints a mixed but ultimately positive picture for the Communication Services sector. While there are concerns like TikTok's cybersecurity vulnerabilities and challenges facing Obamacare enrollment, the dominant themes are positive: Larry Ellison's significant investment in Paramount, Roku's expanded partnership with Nielsen, Silynxcom's defense orders, and RBC's upgrade of the sector. The quantitative signal of 0.26 also supports a mildly positive sentiment. The recency bias heavily favors the positive developments from the last 48 hours, outweighing the earlier negative news.",7.73,Bullish
2025-12-24,Consumer Defensive,67,7.5,"The recent news indicates a mix of positive and negative signals within the Consumer Defensive sector, but the latest news from the past 48 hours, such as Dollar General's strong growth prospects and Nestle's strategic alignment post-Herta Foods sale, carry more weight due to recency bias. These positive developments outweigh the negatives like Mothercare's sales drop and Saks Global's bankruptcy considerations.",8.2,"After analyzing the news feed, I applied a 3x weightage to recent news (last 48 hours) to account for recency bias. The weighted analysis suggests a positive trend in the Consumer Defensive sector, driven by news of Agios Pharmaceuticals' FDA approval, Dollar General's growth prospects, and a tech rally led by Micron. However, some negative news, such as Mothercare's 25% drop in retail sales and S&P's downgrade of Ontex Group's outlook, was largely offset by positive developments.",5.5,"The recent news paints a mixed but ultimately cautiously optimistic picture for the Consumer Defensive sector. While there are concerns like Saks Global's potential bankruptcy, Mothercare's sales decline, and BMO's caution regarding Novo Nordisk, positive signals are emerging. Specifically, the strong growth outlook for dollar store stocks (Dollar General), Raymond James's 'Outperform' rating for Levi Strauss, UBS's picks for athletic footwear, and the upgrade of cbdMD all suggest underlying strength. The recency bias heavily favors the more positive news from the last 48 hours, outweighing the negative developments.",7.07,Bullish
2025-12-24,Financials,362,5.5,"The latest news indicates a mix of positive and negative developments, but the most recent news from the last 48 hours leans more positively, especially with strong performances from companies like Medline and Oracle, and upgrades from analysts. However, there are also downgrades and negative outlooks from some companies, such as New Fortress Energy and Blackstone's LivCor. Overall, the recency bias suggests a slightly more positive sentiment.",7.8,"After analyzing the provided news feed, I noticed a significant amount of positive news from the last 48 hours, particularly regarding the AI sector. The recent news about Oracle's Michigan data center project, Coinbase's expansion into stock trading, and the positive outlook for European stocks have contributed to a bullish sentiment. However, I must consider the Recency Bias, which might overemphasize the recent news, and balance it with the overall trend. Considering the mixed news from the past few days, I conclude that the overall sentiment is leaning towards a Bullish outlook.",7.5,"The recent news paints a mixed but ultimately positive picture for the Financials sector. While there are concerns like Moody's downgrades (Adecoagro, New Fortress Energy) and S&P downgrades, these are offset by positive developments such as Korea Zinc's court approval, Lockheed Martin's contract modification, and Moody’s upgrade of Moody’s Corporation. The strong performance of Nvidia and other tech stocks, coupled with positive economic data and increased revenue reports from companies like Motive Technologies, indicate underlying strength. The recency bias heavily favors the positive news from the last 48 hours, suggesting a more optimistic near-term outlook.",6.92,Bullish
2025-12-24,Real Estate,29,5.5,"The most recent news, especially from the past 48 hours, shows mixed signals but leans slightly positive with significant acquisitions and investments in real estate properties. However, there are also downgrades and concerns raised by analysts, particularly regarding specific companies like Hufvudstaden and Alexandria Real Estate Equities. The recency bias suggests a slight positive tilt given the major transactions involving KKR and PAG, and the Australian Retirement Trust's investment.",7.5,"The analysis reveals a mixed sentiment for the Real Estate sector, with recent news indicating a shift towards a Bullish outlook due to positive developments such as the acquisition of InstaMortgage by reAlpha Tech and the upgrade of Ryman Hospitality's credit ratings. However, older news highlights concerns such as declining market share for Hemnet and the downgrades of Hufvudstaden and Alexandria Real Estate Equities. Recency bias plays a significant role, with recent news carrying three times the weight of older news, resulting in a net positive sentiment.",5.5,"The recent news paints a mixed but leaning positive picture for the real estate sector. While Kepler downgraded Hufvudstaden, several positive signals emerged within the last 48 hours, including the Australian retirement fund's significant investment in Westfield Sydney, the reAlpha Tech stock surge due to a mortgage lender acquisition, and the Sapporo Holdings sale to a KKR/PAG consortium, indicating strong investor interest. Due to the recency bias, the positive signals outweigh the negative, suggesting a cautiously optimistic sentiment, particularly driven by data center investments and continued activity in the REIT space.",6.16,Neutral
2025-12-24,Utilities,121,5.5,"Recent news indicates a mixed sentiment but leans slightly positive, with several companies receiving upgrades and securing contracts. However, there are also negative events such as downgrades and stock plunges. The recency bias suggests that the latest news, especially the S&P upgrade of FirstEnergy and the positive outlook for UGI, might weigh more heavily in the analysis.",5.5,"After analyzing the news feed, I noticed a mix of positive and negative news for the Utilities sector. Recent news from the last 48 hours, such as the upgrade of FirstEnergy to 'BBB+' by S&P, the acquisition of Intersect by Alphabet, and the approval of DTE Energy's plan to power Oracle-OpenAI data center, have a significant impact on the overall sentiment. However, older news about the US freezing major offshore wind projects and the cancellation of the Ford-LG Energy Solution EV battery deal also contribute to a neutral outlook due to recency bias.",7.5,"The recent news paints a mixed but ultimately positive picture for the Utilities sector. While New Fortress Energy's downgrade and Elong Power's reverse split are concerning, they are outweighed by positive developments like FirstEnergy's upgrade, Canada and Brazil's stock market gains including Utilities, Vattenfall seeking funding for nuclear, and PG&E issuing credits. The quantitative signal of 0.35 further supports a moderately positive sentiment. The recency bias heavily favors the more recent positive news, suggesting a strengthening outlook despite some challenges.",6.16,Neutral
